{
  "$schema": "http://json-schema.org/draft-06/schema#",
  "type": "array",
  "definitions": {
    "data_provider": {
      "type": "object",
      "properties": {
        "__comment": {
          "type": "string"
        },
        "source": {
          "type": "string"
        },
        "jql": {
          "type": "string"
        },
        "method": {
          "type": "string"
        },
        "filter": {
          "type": "string"
        },
        "statuses": {
          "type": "array",
          "items": {
            "type": "object",
            "properties": {
              "source": {
                "type": "string",
                "pattern": "issue|changelog"
              },
              "date": {
                "type": "string",
                "pattern": "^{({|%|#).*(}|%|#)}$"
              }
            }
          }
        }
      },
      "required": [
        "source",
        "jql",
        "method"
      ]
    }
  },
  "items": {
  "type": "object",
  "properties": {
    "metric_name": {
      "type": "string",
      "pattern": "(jiradog)(\\.)(([a-z0-9]+)([A-Z]{1}[a-z]*)*)\\.(([a-z0-9]+)([A-Za-z]*)+)"
    },
    "__comment": {
      "type": "string"
    },
    "projects": {
      "type": "array",
      "items": {
        "type": "string"
      }
    },
    "method": {
      "type": "string"
    },
    "issues": {
      "$ref": "#/definitions/data_provider"
    },
    "numerator": {
      "$ref": "#/definitions/data_provider"
    },
    "denominator": {
      "$ref": "#/definitions/data_provider"
    },
    "grouping": {
      "type": "object",
      "properties": {
        "by": {
          "type": "string",
          "pattern": "sprint"
        },
        "count": {
          "type": "string"
        },
        "boards": {
          "type": "object",
          "patternProperties": {
            "[A-Z]*": {
              "type": "number"
            }
          }
        }
      },
      "required": [
        "by",
        "count"
      ]
  }
},
"allOf": [
  {
    "required": [
      "metric_name",
      "projects",
      "method"
    ]
  },
  {
    "oneOf": [
      {
        "required": [
          "issues"
        ]
      },
      {
        "required": [
          "numerator",
          "denominator"
        ]
      }
    ]
  }
]
}
}
