{
  "__comment": "SYS-1633",
  "projects": [
    "MACOSNOTE",
    "WINNOTE",
    "ION",
    "IOSNOTE",
    "DRDNOTE",
    "CE",
    "ENB"
    ],
  "method": "direct",
  "issues": {
    "source": "jira",
    "jql": "Project={{project}} AND Status WAS 'Reopened' AND Updated>endOfDay(-90d)",
    "method": "ticket_count"
    },
  "metric_name": "jiradog.numberOfBugsReopened"
}
